{
  "$schema": "https://json-schema.org/draft/2020-12/schema",
  "$id": "https://github.com/ibrahim7860/Gemma-Guardian/shared/schemas/v1/finding.json",
  "title": "Finding (v1, locked 2026-04-30)",
  "description": "Published on Redis channel drones.<id>.findings. Contract 4 in docs/20-integration-contracts.md.",
  "type": "object",
  "additionalProperties": false,
  "required": [
    "finding_id", "source_drone_id", "timestamp", "type", "severity",
    "gps_lat", "gps_lon", "altitude", "confidence", "visual_description",
    "image_path", "validated", "validation_retries", "operator_status"
  ],
  "properties": {
    "finding_id": {"$ref": "_common.json#/$defs/finding_id"},
    "source_drone_id": {"$ref": "_common.json#/$defs/drone_id"},
    "timestamp": {"$ref": "_common.json#/$defs/iso_timestamp_utc_ms"},
    "type": {"$ref": "_common.json#/$defs/finding_type"},
    "severity": {"$ref": "_common.json#/$defs/severity"},
    "gps_lat": {"$ref": "_common.json#/$defs/lat"},
    "gps_lon": {"$ref": "_common.json#/$defs/lon"},
    "altitude": {"type": "number"},
    "confidence": {"$ref": "_common.json#/$defs/confidence"},
    "visual_description": {"type": "string", "minLength": 10},
    "image_path": {"type": "string", "minLength": 1},
    "validated": {"type": "boolean"},
    "validation_retries": {"type": "integer", "minimum": 0, "maximum": 3},
    "operator_status": {"$ref": "_common.json#/$defs/operator_status"},
    "pixel_bbox": {
      "type": "array",
      "items": {"type": "number", "minimum": 0, "maximum": 1},
      "minItems": 4,
      "maxItems": 4,
      "description": "Optional normalized [x, y, w, h] bbox in image space, emitted by the C2A vision adapter when it localizes a victim."
    }
  }
}
